{
  "schema_version": 1,
  "risk_decision_id": "risk_20260716_000103",
  "risk_unit_id": "position:888",
  "decision_sequence": 103,
  "action": "LIQUIDATE_POSITION",
  "execution_priority": 10,
  "user_id": 1001,
  "account_id": "acc_1001",
  "position_id": 888,
  "position_version": 42,
  "symbol": "BTCUSDT",
  "position_side": "LONG",
  "instruction": {
    "target_quantity": "0.01000000",
    "max_executable_quantity": "0.01000000",
    "quantity_mode": "EXACT",
    "order_type": "MARKET",
    "reduce_only": true,
    "time_in_force": "IOC",
    "max_slippage": "0.005"
  },
  "price_protection": {
    "bankruptcy_price": "54000",
    "max_deviation": "0.03",
    "quote_max_age_ms": 2000
  },
  "execution_policy": {
    "strategy": "ADAPTIVE",
    "urgency": "NORMAL",
    "max_child_orders": 8,
    "max_child_quantity": "0.004",
    "min_child_quantity": "0.001",
    "max_book_participation": "0.5",
    "child_order_cooldown_ms": 250,
    "child_order_timeout_ms": 5000
  },
  "risk_snapshot": {
    "mark_price": "54200",
    "margin_ratio": "0.004",
    "position_size": "0.01000000",
    "market_data_timestamp": "2026-07-16T02:00:00Z"
  },
  "expire_at": "2026-07-16T02:00:05Z",
  "created_at": "2026-07-16T02:00:00Z"
}
